<?xml version="1.0" encoding="UTF-8"?>
<!DOCTYPE Hospital SYSTEM 'Hospital.dtd'>
<Hospital>
    <Hospital.hospitalName>St. James Hospital</Hospital.hospitalName>
    <Hospital.hospitalLocation type = "array">
        <value name ="longitude">53.33886</value>
        <value name = "latitude">-6.297293</value>
    </Hospital.hospitalLocation>
    <Hospita.avaiability type="boolean">true</Hospita.avaiability>
    <Hospital.encryptionModule> 
        <EndcryptionModule>
            <EncryptionModule.key type = "array">
                <!-- same key for all documents?-->
            </EncryptionModule.key>
            <EncryptionModule.dataToEncrypt>
                <!-- what is the data to encrypt?-->
            </EncryptionModule.dataToEncrypt>
        </EndcryptionModule>
    </Hospital.encryptionModule>
    <Hospital.patientChart>
        <PatientChart>

        </PatientChart>
    </Hospital.patientChart>
    <Hospital.hospitalDatabase type = "arrayList"> 
        <patientChart>John Doe</patientChart> 
        <patientChart>Jane Doe</patientChart> 
        <patientChart>Mario Rossi</patientChart> 
    </Hospital.hospitalDatabase>
</Hospital>